{
  "schema": "szk.ma.activity/v1",
  "seq": 1,
  "ts": "2026-10-04T08:00:00Z",
  "actor": "external",
  "action": "table.external_edit",
  "argv": null,
  "inputs": {},
  "outputs": {
    "03_adatok/o1.csv": "9f3a000000000000000000000000000000000000000000000000000000000000"
  },
  "result": null,
  "prev": null
}
