{
  "schema": "szk.ma.activity/v1",
  "seq": 412,
  "ts": "2026-10-04T21:12:00Z",
  "actor": "user:SzK",
  "action": "analyze.commit",
  "argv": [
    "ma.py",
    "analyze",
    "--spec",
    "05_elemzes/specs/o1_primary.json",
    "--out",
    "…"
  ],
  "inputs": {
    "03_adatok/o1.csv": "9f3a000000000000000000000000000000000000000000000000000000000000",
    "05_elemzes/specs/o1_primary.json": "0000000000000000000000000000000000000000000000000000000000000000"
  },
  "outputs": {
    "05_elemzes/o1/20261004T211200Z-a1f3c2/results.json": "0000000000000000000000000000000000000000000000000000000000000000"
  },
  "result": {
    "exit_code": 0,
    "summary": "k=13, RR 0.49 [0.33; 0.73]"
  },
  "prev": "c81e000000000000000000000000000000000000000000000000000000000000"
}
