{
  "schema": "szk.ma.activity/v1",
  "seq": 413,
  "ts": "2026-10-04T21:13:05.120Z",
  "actor": "agent:ma-ellenorzo",
  "action": "project.log",
  "argv": [
    "ma.py",
    "project",
    "log",
    ".",
    "--stage",
    "S12"
  ],
  "inputs": {
    "projekt.sqlite": null
  },
  "outputs": {},
  "result": {
    "exit_code": 0,
    "summary": null
  },
  "details": {
    "kind": "decision",
    "id": 5
  },
  "prev": "c81e000000000000000000000000000000000000000000000000000000000000"
}
